{
  "bridge_schema_id": "bridge_field_frame",
  "field_dtype": "float64",
  "field_shape": [
    10,
    16
  ],
  "has_scalar": false,
  "input_file": "C:\\Users\\slyki\\OneDrive\\Desktop\\coldplate-topgpbridge\\coldplate-topobridge\\tmp_robustness_probe\\variants\\resolution_16x10\\fields\\straight_stack\\straight_stack__z00.npz",
  "input_sha256": "773b713c0f8c720912a748cbeeb5271de96a5342175bf226effe42b329de1fa1",
  "low_signal_fraction": 0.0,
  "low_signal_threshold": 0.009775,
  "magnitude_stats": {
    "max": 0.9775,
    "mean": 0.7374999999999999,
    "min": 0.4374999999999998,
    "std": 0.22449944320643656
  },
  "provenance": {
    "experimental_case": {
      "case_id": "straight_stack",
      "description": "Straight channel stack. Each slice uses the same exact plane-Poiseuille profile as a low-complexity multi-slice baseline.",
      "domain_bounds": {
        "x_max": 1.0,
        "x_min": 0.0,
        "y_max": 0.6,
        "y_min": -0.6,
        "z_max": 1.0,
        "z_min": 0.0
      },
      "experiment_id": "multi_slice_3d_critic_v1",
      "experiment_label": "EXPERIMENTAL_SANDBOX_MULTI_SLICE_3D_CRITIC",
      "experimental_controls": {
        "grid_nx": 16,
        "grid_ny": 10,
        "n_slices": 3,
        "perturbation": {
          "amplitude_fraction": 0.0,
          "mode": "none",
          "note": "No perturbation applied.",
          "phase_seed": 0
        }
      },
      "geometry_case": "stacked_straight_channel",
      "geometry_parameters": {
        "channel_height": 0.8
      },
      "physics_note": "Exact analytic per-slice baseline for the imposed slit geometry. This is a deterministic stack control only.",
      "provenance_class": "EXACT_ANALYTIC",
      "scope_guardrails": [
        "EXPERIMENTAL_SANDBOX only",
        "No physical realism claim",
        "No vortex correspondence claim",
        "No TopoStream semantic compatibility claim",
        "No validated ranking of 3D TPMS coldplate candidates",
        "No physics validation claim"
      ],
      "simple_3d_proxy": {
        "representation": "stacked_2d_slices",
        "slice_generation_rule": "Identical analytic slice repeated across z to establish the multi-slice baseline.",
        "slice_id": "straight_stack__z00",
        "slice_index": 0,
        "z_position": 0.0
      }
    },
    "field_frozen_at": "2026-03-11T00:00:00Z",
    "grid_dx": 0.0625,
    "grid_dy": 0.12,
    "grid_nx": 16,
    "grid_ny": 10,
    "preprocessing": [
      "EXPERIMENTAL_SANDBOX",
      "multi_slice_3d_critic_case_generation"
    ],
    "schema_version": "1.0.0",
    "source_artifact": "fields/straight_stack/straight_stack__z00.npz",
    "source_commit": "dcdd37b369d61e79d2c0a5b5ce8796b219c7e3fe",
    "source_repo": "coldplate-topobridge",
    "source_stage": "experimental_multi_slice_3d_critic"
  },
  "schema_version": "1.0.0",
  "solid_mask_fraction": 0.4
}
