{
  "bridge_schema_id": "bridge_field_frame",
  "field_dtype": "float64",
  "field_shape": [
    6,
    10
  ],
  "has_scalar": false,
  "input_file": "C:\\Users\\slyki\\OneDrive\\Desktop\\coldplate-topgpbridge\\coldplate-topobridge\\tmp_robustness_profile\\variants\\resolution_10x6\\fields\\obstruction_stack\\obstruction_stack__z01.npz",
  "input_sha256": "457cc5e8d41d0a9a588c42496725af44d350008806826045580570d75e0abeac",
  "low_signal_fraction": 0.0,
  "low_signal_threshold": 0.01275856797486364,
  "magnitude_stats": {
    "max": 1.275856797486364,
    "mean": 0.6726652616496923,
    "min": 0.4329514310821993,
    "std": 0.25881475569845386
  },
  "provenance": {
    "experimental_case": {
      "case_id": "obstruction_stack",
      "description": "Straight channel with one obstruction whose position and radius vary deterministically across slices.",
      "domain_bounds": {
        "x_max": 1.0,
        "x_min": 0.0,
        "y_max": 0.6,
        "y_min": -0.6,
        "z_max": 1.0,
        "z_min": 0.0
      },
      "experiment_id": "multi_slice_3d_critic_v1",
      "experiment_label": "EXPERIMENTAL_SANDBOX_MULTI_SLICE_3D_CRITIC",
      "experimental_controls": {
        "grid_nx": 10,
        "grid_ny": 6,
        "n_slices": 3,
        "perturbation": {
          "amplitude_fraction": 0.0,
          "mode": "none",
          "note": "No perturbation applied.",
          "phase_seed": 0
        }
      },
      "geometry_case": "stacked_offset_obstruction_channel",
      "geometry_parameters": {
        "channel_height": 0.8,
        "gap_boost_strength": 0.25,
        "obstacle_center_x": 0.49,
        "obstacle_center_y": 0.05,
        "obstacle_radius": 0.105,
        "wake_strength": 0.32
      },
      "physics_note": "SYNTHETIC: the slice fields are structured surrogate fields built to test whether descriptor separation survives controlled slice-to-slice variation.",
      "provenance_class": "SYNTHETIC",
      "scope_guardrails": [
        "EXPERIMENTAL_SANDBOX only",
        "No physical realism claim",
        "No vortex correspondence claim",
        "No TopoStream semantic compatibility claim",
        "No validated ranking of 3D TPMS coldplate candidates",
        "No physics validation claim"
      ],
      "simple_3d_proxy": {
        "representation": "stacked_2d_slices",
        "slice_generation_rule": "The obstruction center, radius, wake attenuation, and gap boost vary deterministically with z.",
        "slice_id": "obstruction_stack__z01",
        "slice_index": 1,
        "z_position": 0.5
      }
    },
    "field_frozen_at": "2026-03-11T00:00:00Z",
    "grid_dx": 0.1,
    "grid_dy": 0.19999999999999998,
    "grid_nx": 10,
    "grid_ny": 6,
    "preprocessing": [
      "EXPERIMENTAL_SANDBOX",
      "multi_slice_3d_critic_case_generation"
    ],
    "schema_version": "1.0.0",
    "source_artifact": "fields/obstruction_stack/obstruction_stack__z01.npz",
    "source_commit": "dcdd37b369d61e79d2c0a5b5ce8796b219c7e3fe",
    "source_repo": "coldplate-topobridge",
    "source_stage": "experimental_multi_slice_3d_critic"
  },
  "schema_version": "1.0.0",
  "solid_mask_fraction": 0.36666666666666664
}
