{
  "bridge_schema_id": "bridge_field_frame",
  "field_dtype": "float64",
  "field_shape": [
    8,
    12
  ],
  "has_scalar": false,
  "input_file": "C:\\Users\\slyki\\OneDrive\\Desktop\\coldplate-topgpbridge\\coldplate-topobridge\\tmp_robustness_probe\\variants\\slice_count_5\\fields\\constriction_stack\\constriction_stack__z01.npz",
  "input_sha256": "498f2c174773a3ac353c99d79bb2229d93624beac145f6248b500b2685562bdd",
  "low_signal_fraction": 0.0,
  "low_signal_threshold": 0.014511626358135077,
  "magnitude_stats": {
    "max": 1.4511626358135077,
    "mean": 0.695271021395115,
    "min": 0.028884288402075572,
    "std": 0.40283063948254405
  },
  "provenance": {
    "experimental_case": {
      "case_id": "constriction_stack",
      "description": "Smooth constriction stack from a streamfunction with throat depth, width, and center varying deterministically across slices.",
      "domain_bounds": {
        "x_max": 1.0,
        "x_min": 0.0,
        "y_max": 0.6,
        "y_min": -0.6,
        "z_max": 1.0,
        "z_min": 0.0
      },
      "experiment_id": "multi_slice_3d_critic_v1",
      "experiment_label": "EXPERIMENTAL_SANDBOX_MULTI_SLICE_3D_CRITIC",
      "experimental_controls": {
        "grid_nx": 12,
        "grid_ny": 8,
        "n_slices": 5,
        "perturbation": {
          "amplitude_fraction": 0.0,
          "mode": "none",
          "note": "No perturbation applied.",
          "phase_seed": 0
        }
      },
      "geometry_case": "stacked_breathing_constriction_channel",
      "geometry_parameters": {
        "base_height": 0.8,
        "throat_center_x": 0.44999999999999996,
        "throat_depth_fraction": 0.37313708498984766,
        "throat_sigma": 0.12060660171779822
      },
      "physics_note": "QUASI_ANALYTICAL: exact for the constructed streamfunction in each slice, but not claimed as a validated Navier-Stokes or coldplate-physics solution.",
      "provenance_class": "QUASI_ANALYTICAL",
      "scope_guardrails": [
        "EXPERIMENTAL_SANDBOX only",
        "No physical realism claim",
        "No vortex correspondence claim",
        "No TopoStream semantic compatibility claim",
        "No validated ranking of 3D TPMS coldplate candidates",
        "No physics validation claim"
      ],
      "simple_3d_proxy": {
        "representation": "stacked_2d_slices",
        "slice_generation_rule": "Constriction depth, sigma, and center vary smoothly with z while the per-slice field remains continuity-consistent for the constructed streamfunction.",
        "slice_id": "constriction_stack__z01",
        "slice_index": 1,
        "z_position": 0.25
      }
    },
    "field_frozen_at": "2026-03-11T00:00:00Z",
    "grid_dx": 0.08333333333333333,
    "grid_dy": 0.15,
    "grid_nx": 12,
    "grid_ny": 8,
    "preprocessing": [
      "EXPERIMENTAL_SANDBOX",
      "multi_slice_3d_critic_case_generation"
    ],
    "schema_version": "1.0.0",
    "source_artifact": "fields/constriction_stack/constriction_stack__z01.npz",
    "source_commit": "dcdd37b369d61e79d2c0a5b5ce8796b219c7e3fe",
    "source_repo": "coldplate-topobridge",
    "source_stage": "experimental_multi_slice_3d_critic"
  },
  "schema_version": "1.0.0",
  "solid_mask_fraction": 0.3541666666666667
}
