{
  "bridge_schema_id": "bridge_field_frame",
  "field_dtype": "float64",
  "field_shape": [
    50,
    50
  ],
  "has_scalar": true,
  "input_file": "/home/user/coldplate-topobridge/baseline_candidtate_velocity_field.npz",
  "input_sha256": "fdd0030428f0d9ca1c984b59d1d2e29d9ff76fc1a8d8ddb629b408aa816cfc68",
  "low_signal_fraction": 1.0,
  "low_signal_threshold": 5.604376903400905e-09,
  "magnitude_stats": {
    "max": 5.604376903400905e-09,
    "mean": 8.271643694180799e-10,
    "min": 0.0,
    "std": 5.326026082456344e-10
  },
  "provenance": {
    "field_frozen_at": "2026-03-06T10:26:58.734643Z",
    "grid_dx": 0.1,
    "grid_dy": 0.1,
    "grid_nx": 50,
    "grid_ny": 50,
    "preprocessing": [
      "stage4_velocity_field_slice:axis=z,index=15",
      "solid_detection:method=velocity_magnitude_threshold",
      "axes_transpose:stage4_nx_ny_nz_to_bridge_ny_nx"
    ],
    "schema_version": "1.0.0",
    "source_artifact": "candidate_01_diamond_2d_s1127/velocity_field.npz",
    "source_commit": "617eb6ab06191e624373f98dea65542e0e460bb7",
    "source_repo": "coldplate-design-engine",
    "source_stage": "stage4_sim"
  },
  "schema_version": "1.0.0",
  "solid_mask_fraction": 0.0
}