{
  "bridge_schema_id": "bridge_field_frame",
  "field_dtype": "float64",
  "field_shape": [
    50,
    50
  ],
  "has_scalar": true,
  "input_file": "/home/user/coldplate-topobridge/01_diamond_velocity_field.npz",
  "input_sha256": "d3ea45f4601e2d4441741d90ea03e2ea072b969a3a2f80a1e775e85e35017696",
  "low_signal_fraction": 0.002188183807439825,
  "low_signal_threshold": 1.8774387163645503,
  "magnitude_stats": {
    "max": 187.74387163645503,
    "mean": 77.3546567022616,
    "min": 0.5313718836275221,
    "std": 34.115667832547935
  },
  "provenance": {
    "field_frozen_at": "2026-03-06T10:26:58.734643Z",
    "grid_dx": 0.1,
    "grid_dy": 0.1,
    "grid_nx": 50,
    "grid_ny": 50,
    "preprocessing": [
      "stage4_velocity_field_slice:axis=z,index=45",
      "solid_detection:method=velocity_magnitude_threshold",
      "axes_transpose:stage4_nx_ny_nz_to_bridge_ny_nx"
    ],
    "schema_version": "1.0.0",
    "source_artifact": "candidate_01_diamond_2d_s1127/velocity_field.npz",
    "source_commit": "617eb6ab06191e624373f98dea65542e0e460bb7",
    "source_repo": "coldplate-design-engine",
    "source_stage": "stage4_sim"
  },
  "schema_version": "1.0.0",
  "solid_mask_fraction": 0.4516
}