{
  "bridge_schema_id": "bridge_field_frame",
  "field_dtype": "float64",
  "field_shape": [
    50,
    50
  ],
  "has_scalar": true,
  "input_file": "C:\\Users\\slyki\\OneDrive\\Desktop\\coldplate-topgpbridge\\coldplate-design-engine\\results\\stage4_sim_full\\baseline_uniform_channel_ctrl\\velocity_field.npz",
  "input_sha256": "fdd0030428f0d9ca1c984b59d1d2e29d9ff76fc1a8d8ddb629b408aa816cfc68",
  "low_signal_fraction": 0.0044,
  "low_signal_threshold": 4.661725973606036e-11,
  "magnitude_stats": {
    "max": 4.661725973606036e-09,
    "mean": 9.345508763134788e-10,
    "min": 0.0,
    "std": 6.026802388221135e-10
  },
  "provenance": {
    "field_frozen_at": "2026-03-10T23:57:30.923362+00:00",
    "grid_dx": 0.1,
    "grid_dy": 0.1,
    "grid_nx": 50,
    "grid_ny": 50,
    "preprocessing": [
      "stage4_velocity_field_slice:axis=z,index=25",
      "solid_detection:method=velocity_magnitude_threshold",
      "axes_transpose:stage4_nx_ny_nz_to_bridge_ny_nx"
    ],
    "schema_version": "1.0.0",
    "source_artifact": "baseline_uniform_channel_ctrl/velocity_field.npz",
    "source_commit": "8c5ead7cefd0a9a4035b161b5f690fe3c0ab8838",
    "source_repo": "coldplate-design-engine",
    "source_stage": "stage4_sim"
  },
  "schema_version": "1.0.0",
  "solid_mask_fraction": 0.0
}